{
  "schema_version": "1",
  "task_id": "trade-regulatory.permission-block",
  "task_version": "1.0.0",
  "scenario_class": "PERMISSION_BLOCK",
  "title": "Permission block",
  "task_text": "Describe the supplied synthetic trade notice only if the application permission gate allows progression.",
  "query": "synthetic",
  "context_ref": {
    "id": "context.synthetic-blocked.001",
    "version": "1.0.0"
  },
  "sources": [
    {
      "corpus_id": "corpus.synthetic-trade-notice.001",
      "corpus_version": "1.0.0",
      "source_id": "synthetic-trade-notice-001",
      "source_version": "1.0.0",
      "chunk_id": "synthetic-trade-notice-chunk-001",
      "ordinal": 0
    }
  ],
  "model_fixture_ref": {
    "id": "model-output.trade-regulatory-grounded.001",
    "version": "1.0.0"
  },
  "automated_control_ref": {
    "task_id": "p0-source-grounded-output",
    "task_version": "1.0.0",
    "rubric_id": "p0-deterministic-critical-gate",
    "rubric_version": "1.0.0"
  },
  "expected": {
    "permission_state": "BLOCK",
    "run_status": "PERMISSION_STOPPED",
    "retrieval_called": false,
    "model_called": false,
    "criteria": {
      "authorized-source": "UNKNOWN",
      "citation-resolution": "UNKNOWN",
      "permission-boundary": "PASS",
      "provenance-completeness": "PASS"
    },
    "gate": "BLOCK",
    "review_state": "NOT REVIEWABLE",
    "allowed_decisions": []
  },
  "expected_output_behavior": "No generated output; permission stops retrieval and model execution.",
  "safe_failure": "Stop before retrieval and generation. No review decision is available.",
  "configuration_options": {
    "task_pack_id": "trade-regulatory-research",
    "task_pack_version": "1.0.0",
    "domain_task_id": "trade-regulatory.permission-block",
    "domain_task_version": "1.0.0",
    "scenario_class": "PERMISSION_BLOCK"
  },
  "substantive_rubric_ref": {
    "id": "trade-regulatory-substantive-review",
    "version": "1.0.0"
  },
  "substantive_review": {
    "status": "DRAFT",
    "reviewer_id": null,
    "reviewed_at": null,
    "criterion_results": {}
  },
  "prospect_demo_eligible": false
}
