{
  "schema_version": "1",
  "task_id": "trade-regulatory.insufficient-source",
  "task_version": "1.0.0",
  "scenario_class": "INSUFFICIENT_SOURCE",
  "title": "Insufficient source",
  "task_text": "Assess whether the supplied source establishes a licensing requirement or penalty. Bound every conclusion to the supplied source, cite it, and request adequate authority when insufficient.",
  "query": "synthetic",
  "context_ref": {
    "id": "context.synthetic-request.001",
    "version": "1.0.0"
  },
  "sources": [
    {
      "corpus_id": "corpus.synthetic-trade-notice.001",
      "corpus_version": "1.0.0",
      "source_id": "synthetic-trade-notice-001",
      "source_version": "1.0.0",
      "chunk_id": "synthetic-trade-notice-chunk-001",
      "ordinal": 0
    }
  ],
  "model_fixture_ref": {
    "id": "model-output.trade-regulatory-insufficient-source.001",
    "version": "1.0.0"
  },
  "automated_control_ref": {
    "task_id": "p0-source-grounded-output",
    "task_version": "1.0.0",
    "rubric_id": "p0-deterministic-critical-gate",
    "rubric_version": "1.0.0"
  },
  "expected": {
    "permission_state": "ALLOW",
    "run_status": "GENERATED",
    "retrieval_called": true,
    "model_called": true,
    "criteria": {
      "authorized-source": "PASS",
      "citation-resolution": "PASS",
      "permission-boundary": "PASS",
      "provenance-completeness": "PASS"
    },
    "gate": "PASS",
    "review_state": "PENDING",
    "allowed_decisions": [
      "APPROVE",
      "REJECT",
      "REQUEST_REVISION"
    ]
  },
  "expected_output_behavior": "State that the supplied source does not establish a licensing requirement or penalty; do not claim that none exists.",
  "safe_failure": "Decline to infer applicable law from this supplied source; request adequate authority and qualified substantive review.",
  "configuration_options": {
    "task_pack_id": "trade-regulatory-research",
    "task_pack_version": "1.0.0",
    "domain_task_id": "trade-regulatory.insufficient-source",
    "domain_task_version": "1.0.0",
    "scenario_class": "INSUFFICIENT_SOURCE"
  },
  "substantive_rubric_ref": {
    "id": "trade-regulatory-substantive-review",
    "version": "1.0.0"
  },
  "substantive_review": {
    "status": "DRAFT",
    "reviewer_id": null,
    "reviewed_at": null,
    "criterion_results": {}
  },
  "prospect_demo_eligible": false
}
